{
  "job_id": "B1",
  "verdict": "PARKED-HONEST",
  "attribution": "BUILD",
  "wall_clock_s": 2591.188000000002,
  "samples_consumed": -1,
  "packs_consumed": 0,
  "interventions": 0,
  "run_id": "20260707-001948-bd",
  "plan_id": "",
  "repo": "battery-b1-expense-cli",
  "card_path": "evals/battery/B1.json",
  "evidence": {
    "oracle_status": "not-run",
    "summary": "<home>\\agentic-setup\\state\\fleet-runs\\20260707-001948-bd\\SUMMARY.txt",
    "job_summary": "<home>\\agentic-setup\\state\\fleet-runs\\20260707-001948-bd\\JOB_SUMMARY.txt",
    "progress": "<home>\\agentic-setup\\state\\fleet-runs\\20260707-001948-bd\\swap-progress.log",
    "packs": "<home>\\agentic-setup\\state\\fleet-runs\\20260707-001948-bd\\context-packs.log"
  },
  "versions": {
    "battery_runner": "v1",
    "blarai": "6d93ba1",
    "python": "3.11.9",
    "models": "unmeasured-at-runner (see the residency's PERFORMANCE_LOG entry)"
  },
  "started_utc": "2026-07-07T07:18:23Z",
  "finished_utc": "2026-07-07T08:01:35Z",
  "dry_run": false,
  "notes": "flat-queue mode (no plan-graph): job-level verdict computed from per-task outcomes; no job oracle ran",
  "schema": "battery-scorecard/v1"
}
